ORD	Coach Dan Henning made the announcement [MASK] a two-hour scrimmage at Alumni Stadium Friday.	41 42 61 62 120 121 122 123 124 125 126 127	1.0 0.0 0.0 0.0 0.0 0.0 0.0 0.0 0.0 0.0 0.0 0.0
ORD	The group was released unharmed [MASK] an undisclosed ransom was paid.	41 42 61 62 120 121 122 123 124 125 126 127	1.0 0.0 0.0 0.0 0.0 0.0 0.0 0.0 0.0 0.0 0.0 0.0
ORD	He has survived several previous assassination attempts since becoming president [MASK] the fall of the Taliban.	41 42 61 62 120 121 122 123 124 125 126 127	1.0 0.0 0.0 0.0 0.0 0.0 0.0 0.0 0.0 0.0 0.0 0.0
ORD	But [MASK] that period produced some memorably shocking art and some more subtle, protean talents--people like Laurie Anderson, Vito Acconci and Bruce Nauman--Jonas has spent the ensuing decades tilling the same thin soil.	41 42 61 62 120 121 122 123 124 125 126 127	0.0 0.0 1.0 0.0 0.0 0.0 0.0 0.0 0.0 0.0 0.0 0.0
ORD	She made headlines in 1987 [MASK] she survived a small airplane crash.	41 42 61 62 120 121 122 123 124 125 126 127	0.0 0.0 0.0 1.0 0.0 0.0 0.0 0.0 0.0 0.0 0.0 0.0
ORD	"Garlasco said more work needs to be done [MASK] a solid conclusion can be drawn."""	41 42 61 62 120 121 122 123 124 125 126 127	0.0 1.0 0.0 0.0 0.0 0.0 0.0 0.0 0.0 0.0 0.0 0.0
ORD	Even though people did all they could to get off the Rock [MASK] its 29 years as a maximum-security prison, now they are fighting to get on.	41 42 61 62 120 121 122 123 124 125 126 127	0.0 0.0 1.0 0.0 0.0 0.0 0.0 0.0 0.0 0.0 0.0 0.0
ORD	The two NSCN leaders visited India in January 2003 [MASK] 37 years in self-imposed exile and met then-prime minister Atal Behari Vajpayee.	41 42 61 62 120 121 122 123 124 125 126 127	1.0 0.0 0.0 0.0 0.0 0.0 0.0 0.0 0.0 0.0 0.0 0.0
ORD	Herren was known as an ` ` academic risk''[MASK] he came to BC last fall.	41 42 61 62 120 121 122 123 124 125 126 127	0.0 0.0 0.0 1.0 0.0 0.0 0.0 0.0 0.0 0.0 0.0 0.0
ORD	Russian troops Tuesday bombarded Sernovodsk in western Chechnya where civilians remained trapped [MASK] the village was again sealed off.	41 42 61 62 120 121 122 123 124 125 126 127	1.0 0.0 0.0 0.0 0.0 0.0 0.0 0.0 0.0 0.0 0.0 0.0
ORD	[MASK] I had the most money, I was the least happy.	41 42 61 62 120 121 122 123 124 125 126 127	0.0 0.0 0.0 1.0 0.0 0.0 0.0 0.0 0.0 0.0 0.0 0.0
ORD	The board's part of the war effort was supplying soldiers with necessities, like tires, [MASK] the Japanese seizure of rubber plantations throughout the Pacific had made rubber scarce.	41 42 61 62 120 121 122 123 124 125 126 127	1.0 0.0 0.0 0.0 0.0 0.0 0.0 0.0 0.0 0.0 0.0 0.0
ORD	Lynette Louden, 47, said she called police about the SUV across the street from her home on Chicago's West Side [MASK] her family's Chihuahua started barking at it early Monday.	41 42 61 62 120 121 122 123 124 125 126 127	1.0 0.0 0.0 0.0 0.0 0.0 0.0 0.0 0.0 0.0 0.0 0.0
ORD	The legislation, approved today on a 305-117 vote, would let the regional Baby Bells enter the $ 70 billion long-distance market [MASK] showing that their own local markets have been opened to competition.	41 42 61 62 120 121 122 123 124 125 126 127	1.0 0.0 0.0 0.0 0.0 0.0 0.0 0.0 0.0 0.0 0.0 0.0
ORD	Lehane said the two men were friends [MASK] having worked together at the White House and Gore ` ` thought it was appropriate''to personally call.	41 42 61 62 120 121 122 123 124 125 126 127	1.0 0.0 0.0 0.0 0.0 0.0 0.0 0.0 0.0 0.0 0.0 0.0
ORD	The House of Representatives'Ways and Means Committee approved the compromise bill by voice vote Thursday [MASK] weeks of negotiations with White House officials, House and Senate Republican leaders.	41 42 61 62 120 121 122 123 124 125 126 127	1.0 0.0 0.0 0.0 0.0 0.0 0.0 0.0 0.0 0.0 0.0 0.0
ORD	Republicans wanted to add dozens of amendments, an obvious delaying tactic, [MASK] Democrats tried to block all but their own amendments.	41 42 61 62 120 121 122 123 124 125 126 127	0.0 0.0 1.0 0.0 0.0 0.0 0.0 0.0 0.0 0.0 0.0 0.0
ORD	"""I had been up all night and was very upset, and [MASK] I bumped into Diana I burst into tears,""said Neathey, who was outside Kensington Palace."""	41 42 61 62 120 121 122 123 124 125 126 127	0.0 0.0 0.0 1.0 0.0 0.0 0.0 0.0 0.0 0.0 0.0 0.0
ORD	Organisers said they were disappointed China's President Hu Jintao had left Hong Kong [MASK] the start of the rally.	41 42 61 62 120 121 122 123 124 125 126 127	0.0 1.0 0.0 0.0 0.0 0.0 0.0 0.0 0.0 0.0 0.0 0.0
ORD	Topolanek was in Moldova on Wednesday to assess the situation [MASK] violent protests earlier this month left at least two people dead, more than 90 injured and led to 200 arrests.	41 42 61 62 120 121 122 123 124 125 126 127	1.0 0.0 0.0 0.0 0.0 0.0 0.0 0.0 0.0 0.0 0.0 0.0
ORD	Iraq Kurdistan rebelled against the central authorities in Baghdad [MASK] Iraq lost the 1991 Gulf War.	41 42 61 62 120 121 122 123 124 125 126 127	1.0 0.0 0.0 0.0 0.0 0.0 0.0 0.0 0.0 0.0 0.0 0.0
ORD	Lewinsky took the dress and tape with her [MASK] she went to her lawyers'office to sign papers relating to the immunity deal, sources said.	41 42 61 62 120 121 122 123 124 125 126 127	0.0 0.0 0.0 1.0 0.0 0.0 0.0 0.0 0.0 0.0 0.0 0.0
ORD	Under U. N. resolutions following the 1991 Gulf War, Iraq is to destroy its biological, chemical and nuclear weapons programs [MASK] a U. N. trade embargo can be lifted.	41 42 61 62 120 121 122 123 124 125 126 127	0.0 1.0 0.0 0.0 0.0 0.0 0.0 0.0 0.0 0.0 0.0 0.0
ORD	Mugabe, who has ruled the former British colony since independence in 1980, won a second round election [MASK] rival Tsvangirai pulled out, citing a deadly campaign of violence against his supporters.	41 42 61 62 120 121 122 123 124 125 126 127	1.0 0.0 0.0 0.0 0.0 0.0 0.0 0.0 0.0 0.0 0.0 0.0
ORD	Those grants are welcome but still small change [MASK] compared with a five-year, $ 7.5 billion--nonmilitary--aid package approved by Congress and signed into law this year.	41 42 61 62 120 121 122 123 124 125 126 127	0.0 0.0 0.0 1.0 0.0 0.0 0.0 0.0 0.0 0.0 0.0 0.0
ORD	Smrek was credited with another assist 8:09 later [MASK] passing to York on a short-handed breakaway.	41 42 61 62 120 121 122 123 124 125 126 127	1.0 0.0 0.0 0.0 0.0 0.0 0.0 0.0 0.0 0.0 0.0 0.0
ORD	Choi, playing Sun City for the first time, said he understood the course better and said he felt relaxed [MASK] attending a sponsor's party at an artificial beach, followed by a good night's sleep.	41 42 61 62 120 121 122 123 124 125 126 127	1.0 0.0 0.0 0.0 0.0 0.0 0.0 0.0 0.0 0.0 0.0 0.0
ORD	Yvonne Li Yuen-man of Maryknoll Convent School said she did not encounter much difficulty [MASK] she visited homes in Whampoa on Saturday and To Kwa Wan on Sunday.	41 42 61 62 120 121 122 123 124 125 126 127	0.0 0.0 0.0 1.0 0.0 0.0 0.0 0.0 0.0 0.0 0.0 0.0
ORD	But it takes regular enforcement to ensure that those devices are used, and enforcement is always in short supply [MASK] it comes to the environment.	41 42 61 62 120 121 122 123 124 125 126 127	0.0 0.0 0.0 1.0 0.0 0.0 0.0 0.0 0.0 0.0 0.0 0.0
ORD	Syria and France are busy rebuilding once close ties [MASK] several years of tension over Damascus's role in Lebanon.	41 42 61 62 120 121 122 123 124 125 126 127	1.0 0.0 0.0 0.0 0.0 0.0 0.0 0.0 0.0 0.0 0.0 0.0
ORD	Japanese rider Daijiro Kato sustained serious head, neck and chest injuries in a crash [MASK] Sunday's motorcycle Grand Prix of Japan and was in critical condition in hospital, race officials said.	41 42 61 62 120 121 122 123 124 125 126 127	0.0 0.0 1.0 0.0 0.0 0.0 0.0 0.0 0.0 0.0 0.0 0.0
ORD	Madrid collapsed by around 5.0 percent [MASK] the Spanish central bank rescued provincial lender CajaSur over the weekend, heaping more pain on the country's already-strained financial system.	41 42 61 62 120 121 122 123 124 125 126 127	1.0 0.0 0.0 0.0 0.0 0.0 0.0 0.0 0.0 0.0 0.0 0.0
ORD	None of this savage history was linked to Boskic [MASK] he applied for US refugee status in 1999.	41 42 61 62 120 121 122 123 124 125 126 127	0.0 0.0 0.0 1.0 0.0 0.0 0.0 0.0 0.0 0.0 0.0 0.0
ORD	Then, [MASK] the Child camp announced it would consider bids from other publishers for ` ` Baking at Julia's,''Knopf editors became angered and wrote a letter declaring that they would not bid on the book.	41 42 61 62 120 121 122 123 124 125 126 127	0.0 0.0 0.0 1.0 0.0 0.0 0.0 0.0 0.0 0.0 0.0 0.0
ORD	Paris Stedman and Irvin Luke were repairing telephone wires Monday on a hillside outside the capital [MASK] a landslide swept them into a ravine, Police Superintendent Cyril Carrette said Tuesday.	41 42 61 62 120 121 122 123 124 125 126 127	0.0 0.0 0.0 1.0 0.0 0.0 0.0 0.0 0.0 0.0 0.0 0.0
ORD	Weakness in banks and drugs sent Britain's FTSE 100 share index lower, [MASK] a slide on Wall Street on earnings and economic worries piled on pressure.	41 42 61 62 120 121 122 123 124 125 126 127	0.0 0.0 1.0 0.0 0.0 0.0 0.0 0.0 0.0 0.0 0.0 0.0
ORD	More than 330 hostages, half of them children, were killed in a shootout [MASK] a group of armed commandos stormed a school in Beslan, north Ossetia in Russia September 1.	41 42 61 62 120 121 122 123 124 125 126 127	1.0 0.0 0.0 0.0 0.0 0.0 0.0 0.0 0.0 0.0 0.0 0.0
ORD	Michael Harris, who had 34 points and 16 rebounds, led Dongguan to close it up to 84-81 midway in the decisive quarter [MASK] Xinjiang picked up attacking power again to pull away.	41 42 61 62 120 121 122 123 124 125 126 127	0.0 1.0 0.0 0.0 0.0 0.0 0.0 0.0 0.0 0.0 0.0 0.0
ORD	Maskhadov was elected Chechnya's president in 1996 [MASK] Moscow withdrew its troops following a bloody 20-month war that killed as many as 80,000 people _ mostly innocent civilians and inexperienced Russian conscripts.	41 42 61 62 120 121 122 123 124 125 126 127	1.0 0.0 0.0 0.0 0.0 0.0 0.0 0.0 0.0 0.0 0.0 0.0
ORD	At the ceremony, Bonnie Raitt, a foundation trustee, singled out Saul Zaentz, the owner of Fantasy, who is to receive the Irving Thalberg Award for production excellence [MASK] the Oscar ceremonies on March 24.	41 42 61 62 120 121 122 123 124 125 126 127	0.0 0.0 1.0 0.0 0.0 0.0 0.0 0.0 0.0 0.0 0.0 0.0
ORD	Nagai, 50, appeared to be shot at close range, according to television footage, as security forces put down a mass protest in Myanmar's main city Yangon [MASK] weeks of demonstrations led by Buddhist monks.	41 42 61 62 120 121 122 123 124 125 126 127	1.0 0.0 0.0 0.0 0.0 0.0 0.0 0.0 0.0 0.0 0.0 0.0
ORD	` ` [MASK] the alternative is silence, there is n't really an alternative for a musician.''	41 42 61 62 120 121 122 123 124 125 126 127	0.0 0.0 0.0 1.0 0.0 0.0 0.0 0.0 0.0 0.0 0.0 0.0
ORD	Jamal jumped bail and fled Australia on a forged passport [MASK] awaiting trial over the drive-by shooting at the police station in the Sydney suburb of Lakemba in 1998.	41 42 61 62 120 121 122 123 124 125 126 127	0.0 0.0 1.0 0.0 0.0 0.0 0.0 0.0 0.0 0.0 0.0 0.0
ORD	` ` If those songs taught me anything, it's that we're all the same,''Ian says [MASK] a phone call from a tour stop.	41 42 61 62 120 121 122 123 124 125 126 127	0.0 0.0 1.0 0.0 0.0 0.0 0.0 0.0 0.0 0.0 0.0 0.0
ORD	Actors who want to be singers are, most often, like bears who have been trained to juggle [MASK] hopping on one foot.	41 42 61 62 120 121 122 123 124 125 126 127	0.0 0.0 1.0 0.0 0.0 0.0 0.0 0.0 0.0 0.0 0.0 0.0
ORD	Crude oil plunged [MASK] Iraq and the United Nations reached a tentative agreement on a plan that would allow Iraq to sell limited amounts of oil for the first time since 1990.	41 42 61 62 120 121 122 123 124 125 126 127	1.0 0.0 0.0 0.0 0.0 0.0 0.0 0.0 0.0 0.0 0.0 0.0
ORD	The government must either free Khmer Rouge military commander Ta Mok or try him [MASK] his maximum three-year detention period ends next month, his lawyer said Thursday.	41 42 61 62 120 121 122 123 124 125 126 127	0.0 1.0 0.0 0.0 0.0 0.0 0.0 0.0 0.0 0.0 0.0 0.0
ORD	"[MASK] beating the fourth-seeded Serena on Court 2, long known as the Graveyard, Craybas is scheduled to play the 14th-seeded Venus in the same place in the fourth round."""	41 42 61 62 120 121 122 123 124 125 126 127	1.0 0.0 0.0 0.0 0.0 0.0 0.0 0.0 0.0 0.0 0.0 0.0
ORD	The dinosaur bones, Flynn said, ` ` will help tease apart [MASK] it happened, how fast and the processes that caused it.''	41 42 61 62 120 121 122 123 124 125 126 127	0.0 0.0 0.0 1.0 0.0 0.0 0.0 0.0 0.0 0.0 0.0 0.0
ORD	"Tribune said Thursday night [MASK] a five-hour meeting of its board that it had established an independent special committee""to oversee management's exploration of alternatives for creating additional value for shareholders."""	41 42 61 62 120 121 122 123 124 125 126 127	1.0 0.0 0.0 0.0 0.0 0.0 0.0 0.0 0.0 0.0 0.0 0.0
ORD	Three of the bombers disguised in army uniforms stormed a government office in Kandahar [MASK] the fourth attacker detonated a car bomb.	41 42 61 62 120 121 122 123 124 125 126 127	1.0 0.0 0.0 0.0 0.0 0.0 0.0 0.0 0.0 0.0 0.0 0.0
ORD	A Mariners fan has gone to the American Civil Liberties Union [MASK] he was told _ and rightly so _ to take off a vulgar T-shirt denigrating the Yankees at Safeco Field.	41 42 61 62 120 121 122 123 124 125 126 127	1.0 0.0 0.0 0.0 0.0 0.0 0.0 0.0 0.0 0.0 0.0 0.0
ORD	As prepared as the industry may be to help fuel growth [MASK] a brief economic ride through recession, it may find it difficult to find businesses with good short-term prospects.	41 42 61 62 120 121 122 123 124 125 126 127	0.0 0.0 1.0 0.0 0.0 0.0 0.0 0.0 0.0 0.0 0.0 0.0
ORD	Suggesting EU leaders discuss the issue of sustainable growth [MASK] the summit this June, she stressed the EU's need to sharpen economies'competitiveness and formulate and implement growth strategy.	41 42 61 62 120 121 122 123 124 125 126 127	0.0 0.0 1.0 0.0 0.0 0.0 0.0 0.0 0.0 0.0 0.0 0.0
ORD	"[MASK] Bradford was asked about the worst part about winning the Heisman, he did not hesitate."""	41 42 61 62 120 121 122 123 124 125 126 127	0.0 0.0 0.0 1.0 0.0 0.0 0.0 0.0 0.0 0.0 0.0 0.0
ORD	Several suspects managed to escape [MASK] the gunbattle Friday, which also left four people wounded, the officials and witnesses said.	41 42 61 62 120 121 122 123 124 125 126 127	1.0 0.0 0.0 0.0 0.0 0.0 0.0 0.0 0.0 0.0 0.0 0.0
ORD	Neighbouring Saudi Arabia joined the fray in November, [MASK] accusing the rebels of occupying two villages inside the kingdom's territory and of killing a Saudi border guard.	41 42 61 62 120 121 122 123 124 125 126 127	1.0 0.0 0.0 0.0 0.0 0.0 0.0 0.0 0.0 0.0 0.0 0.0
ORD	Beaird, who succeeded McCaskill, noted that under a strict reading of existing state law it was not a crime to lie to the Gaming Commission [MASK] it was considering an uncontested riverboat gambling license.	41 42 61 62 120 121 122 123 124 125 126 127	0.0 0.0 0.0 1.0 0.0 0.0 0.0 0.0 0.0 0.0 0.0 0.0
ORD	Egyptian-French Committee working on the development of Karnak Temple has made the decision [MASK] the statue was discovered beneath the Obelisk of Hatshepsut in Karnak Temple relic in Luxor, 720 km south of Cairo.	41 42 61 62 120 121 122 123 124 125 126 127	1.0 0.0 0.0 0.0 0.0 0.0 0.0 0.0 0.0 0.0 0.0 0.0
ORD	The operation Tuesday began [MASK] undercover Israeli troops moved several hundred yards (meters) into the territory to strike an abandoned house east of Gaza City that militants used for rocket-launching operations, Hamas said.	41 42 61 62 120 121 122 123 124 125 126 127	0.0 0.0 0.0 1.0 0.0 0.0 0.0 0.0 0.0 0.0 0.0 0.0
ORD	Sony has edited advertisements for a Japanese movie [MASK] Shinto religious authorities complained about an image of a man being hanged from a ceremonial gate, officials said Tuesday.	41 42 61 62 120 121 122 123 124 125 126 127	1.0 0.0 0.0 0.0 0.0 0.0 0.0 0.0 0.0 0.0 0.0 0.0
ORD	"The""National Alliance"", composed of FORD-Kenya, FORD-Asili and the Democratic Party, was formed last month, aiming at choosing one opposition presidential candidate together [MASK] the 1977 general elections to compete with the ruling KANU."	41 42 61 62 120 121 122 123 124 125 126 127	0.0 0.0 1.0 0.0 0.0 0.0 0.0 0.0 0.0 0.0 0.0 0.0
ORD	Items often show a resurgence in popularity [MASK] a new movie or TV show comes out.	41 42 61 62 120 121 122 123 124 125 126 127	1.0 0.0 0.0 0.0 0.0 0.0 0.0 0.0 0.0 0.0 0.0 0.0
ORD	We have finally reached Super Bowl Sunday [MASK] enjoying one of the most heady weeks in recent memory.	41 42 61 62 120 121 122 123 124 125 126 127	1.0 0.0 0.0 0.0 0.0 0.0 0.0 0.0 0.0 0.0 0.0 0.0
ORD	The National Assembly had approved the Constitutional amendments [MASK] three days of debate on March 4, 1999, paving the way for the creation of the Senate.	41 42 61 62 120 121 122 123 124 125 126 127	1.0 0.0 0.0 0.0 0.0 0.0 0.0 0.0 0.0 0.0 0.0 0.0
ORD	"Earlier, Gukasyan had rounded on opposition parties, accusing them of""insinuations""and""libel""[MASK] they accused senior Karabakh officials of abusing their positions in order to win support."	41 42 61 62 120 121 122 123 124 125 126 127	1.0 0.0 0.0 0.0 0.0 0.0 0.0 0.0 0.0 0.0 0.0 0.0
ORD	You know you're in trouble [MASK] the programmers have gone to the extreme of designing looping animations in a feeble effort to make the ` ` please wait''intervals go by faster.)	41 42 61 62 120 121 122 123 124 125 126 127	0.0 0.0 0.0 1.0 0.0 0.0 0.0 0.0 0.0 0.0 0.0 0.0
ORD	[MASK] Continental Airlines picked up its latest jet Thursday, it was the boss who signed the papers, picked up the plane in Seattle and flew it home.	41 42 61 62 120 121 122 123 124 125 126 127	0.0 0.0 0.0 1.0 0.0 0.0 0.0 0.0 0.0 0.0 0.0 0.0
ORD	Earlier in the week, traders and investors pondered the possibility of a rise in official Japanese interest rates [MASK] two reports suggested the economy is recovering at a faster-than-expected clip.	41 42 61 62 120 121 122 123 124 125 126 127	1.0 0.0 0.0 0.0 0.0 0.0 0.0 0.0 0.0 0.0 0.0 0.0
ORD	Zimbabwe were in deep trouble [MASK] Gavin Rennie and Andy Flower fell in quick succession.	41 42 61 62 120 121 122 123 124 125 126 127	0.0 0.0 0.0 1.0 0.0 0.0 0.0 0.0 0.0 0.0 0.0 0.0
ORD	"The fighting began on March 25 [MASK] Prime Minister Nuri al-Maliki ordered his troops to attack Mahdi Army strongholds in Basra, the southern oil hub, which he said were infested by""lawless gunmen."""	41 42 61 62 120 121 122 123 124 125 126 127	0.0 0.0 0.0 1.0 0.0 0.0 0.0 0.0 0.0 0.0 0.0 0.0
ORD	[MASK] the araucana chickens at Martha's Westport, Conn., house lay eggs, the shells inspire color chips ($ 15 for a set).	41 42 61 62 120 121 122 123 124 125 126 127	0.0 0.0 0.0 1.0 0.0 0.0 0.0 0.0 0.0 0.0 0.0 0.0
ORD	And yet, [MASK] news came that the expected U. S. bombing campaign had been averted thanks to Annan's diplomacy, not everyone in Baghdad was elated.	41 42 61 62 120 121 122 123 124 125 126 127	0.0 0.0 0.0 1.0 0.0 0.0 0.0 0.0 0.0 0.0 0.0 0.0
ORD	Ma said the KMT, which ruled the country for decades [MASK] losing power in the 2000 presidential election, does not oppose the plan for no reasons.	41 42 61 62 120 121 122 123 124 125 126 127	0.0 1.0 0.0 0.0 0.0 0.0 0.0 0.0 0.0 0.0 0.0 0.0
ORD	It was the second time Chinese activists had landed on the Senkaku islands, as they are known in China, since they reverted to Japanese control [MASK] the US occupation following World War II.	41 42 61 62 120 121 122 123 124 125 126 127	1.0 0.0 0.0 0.0 0.0 0.0 0.0 0.0 0.0 0.0 0.0 0.0
ORD	"Police said the pair told them they attacked the men [MASK] watching""Bumfights,""the video that shows homeless people fighting one another and engaging in dangerous stunts."	41 42 61 62 120 121 122 123 124 125 126 127	1.0 0.0 0.0 0.0 0.0 0.0 0.0 0.0 0.0 0.0 0.0 0.0
ORD	Hilary P. Pereira expressed her approval on Wednesday of the city's SARS-control measures [MASK] a three-day inspection of a port, a railway station and two international airports.	41 42 61 62 120 121 122 123 124 125 126 127	1.0 0.0 0.0 0.0 0.0 0.0 0.0 0.0 0.0 0.0 0.0 0.0
ORD	He took the ball to the line [MASK] sidestepping in a cross.	41 42 61 62 120 121 122 123 124 125 126 127	0.0 1.0 0.0 0.0 0.0 0.0 0.0 0.0 0.0 0.0 0.0 0.0
ORD	Key blue chips, like China Mobile, ports-to-phone conglomerate Hutchison Whampoa, HSBC Holdings and property giant Cheung Kong slipped down 0.43 percent and 2.3 percent lower in the afternoon [MASK] reports of Bush's victory.	41 42 61 62 120 121 122 123 124 125 126 127	1.0 0.0 0.0 0.0 0.0 0.0 0.0 0.0 0.0 0.0 0.0 0.0
ORD	Dutch prosecutors may review their tactics in the battle against Muslim extremism following the acquittal Thursday of 12 men suspected of supporting terrorism, [MASK] a court ruled that unverified intelligence reports are inadmissible.	41 42 61 62 120 121 122 123 124 125 126 127	0.0 0.0 0.0 1.0 0.0 0.0 0.0 0.0 0.0 0.0 0.0 0.0
ORD	Collins is expected to present a more robust defense [MASK] the penalty phase of the trial.	41 42 61 62 120 121 122 123 124 125 126 127	0.0 0.0 1.0 0.0 0.0 0.0 0.0 0.0 0.0 0.0 0.0 0.0
ORD	The warship--scheduled for replacement in 2012--is set to lead the Orion 08 multi-national task group, which will be carrying out exercises [MASK] the next four months in the Indian Ocean.	41 42 61 62 120 121 122 123 124 125 126 127	0.0 0.0 1.0 0.0 0.0 0.0 0.0 0.0 0.0 0.0 0.0 0.0
ORD	[MASK] he mentioned this to Golisano, the team's owner, Golisano invited him to drop by his box, Christine Anderson, a spokeswoman for the Spitzer campaign, confirmed on Friday.	41 42 61 62 120 121 122 123 124 125 126 127	0.0 0.0 0.0 1.0 0.0 0.0 0.0 0.0 0.0 0.0 0.0 0.0
ORD	[MASK] Davis'first few years in the Senate, he fulfilled his law-and-order campaign pledges and introduced bills to expand the powers of law enforcement officers and increase the scope of the death penalty.	41 42 61 62 120 121 122 123 124 125 126 127	0.0 0.0 1.0 0.0 0.0 0.0 0.0 0.0 0.0 0.0 0.0 0.0
ORD	Even Volvo's wagon sales were halved [MASK] it introduced its XC90 crossover.	41 42 61 62 120 121 122 123 124 125 126 127	0.0 0.0 0.0 1.0 0.0 0.0 0.0 0.0 0.0 0.0 0.0 0.0
ORD	"Last month, Van University deputy general-secretary Enver Arpali hanged himself in the prison laundry [MASK]""the protracted investigation ruined""his spirit, according to his lawyer."	41 42 61 62 120 121 122 123 124 125 126 127	1.0 0.0 0.0 0.0 0.0 0.0 0.0 0.0 0.0 0.0 0.0 0.0
ORD	Starr got only 90 words into his argument [MASK] being interrupted by Kennedy, then Souter, each demanding to know how the banner had been disruptive.	41 42 61 62 120 121 122 123 124 125 126 127	0.0 1.0 0.0 0.0 0.0 0.0 0.0 0.0 0.0 0.0 0.0 0.0
ORD	DUBLIN, Ireland _ The IRA's political partner, Sinn Fein, says no weapons will be handed over [MASK] a negotiated peace settlement.	41 42 61 62 120 121 122 123 124 125 126 127	0.0 1.0 0.0 0.0 0.0 0.0 0.0 0.0 0.0 0.0 0.0 0.0
ORD	Almost daily [MASK] the first four months of 1945, the SS chose prisoners to be sent to the gas chamber, the only one known to have operated at a concentration camp on German soil.	41 42 61 62 120 121 122 123 124 125 126 127	0.0 0.0 1.0 0.0 0.0 0.0 0.0 0.0 0.0 0.0 0.0 0.0
ORD	Bangladesh, sent in to bat by Sri Lankan captain Mahela Jayawardene, folded up for their third lowest Test total in just 32.3 overs an hour [MASK] lunch at the Sinhalese Sport Club here.	41 42 61 62 120 121 122 123 124 125 126 127	1.0 0.0 0.0 0.0 0.0 0.0 0.0 0.0 0.0 0.0 0.0 0.0
ORD	The MetroStars staged their second practice in the area Tuesday [MASK] five weeks of training and playing exhibition games in Italy.	41 42 61 62 120 121 122 123 124 125 126 127	1.0 0.0 0.0 0.0 0.0 0.0 0.0 0.0 0.0 0.0 0.0 0.0
ORD	"Possible tenants can not be identified [MASK] negotiations are going on, said Picket, who added that they would not be""big box""stores."	41 42 61 62 120 121 122 123 124 125 126 127	0.0 0.0 1.0 0.0 0.0 0.0 0.0 0.0 0.0 0.0 0.0 0.0
ORD	A soon-to-be married couple reported missing [MASK] they did n't return to their jobs as camp counselors were found shot to death on a beach, apparently in their sleep, authorities said Thursday.	41 42 61 62 120 121 122 123 124 125 126 127	0.0 0.0 0.0 1.0 0.0 0.0 0.0 0.0 0.0 0.0 0.0 0.0
ORD	[MASK] shooting the scene in which Ali snatched Cosell's toupee on live television, Voight recalled, some of the crew broke into applause.	41 42 61 62 120 121 122 123 124 125 126 127	1.0 0.0 0.0 0.0 0.0 0.0 0.0 0.0 0.0 0.0 0.0 0.0
ORD	Lakota [MASK] many Park City restaurants are close to ski slopes, Lakota, a vaguely Southwestern-style restaurant in the center of town, is literally on a ski slope.	41 42 61 62 120 121 122 123 124 125 126 127	0.0 0.0 1.0 0.0 0.0 0.0 0.0 0.0 0.0 0.0 0.0 0.0
ORD	Last month, [MASK] this new evidence was presented, a judge ruled that Digeo was entitled to no monetary damages from Audible.	41 42 61 62 120 121 122 123 124 125 126 127	0.0 0.0 0.0 1.0 0.0 0.0 0.0 0.0 0.0 0.0 0.0 0.0
ORD	The Dolphins were nursing a seven-point lead [MASK] they stopped Tomlinson for no gain on fourth-and-goal at the 1 in the first minute of the final period.	41 42 61 62 120 121 122 123 124 125 126 127	0.0 0.0 0.0 1.0 0.0 0.0 0.0 0.0 0.0 0.0 0.0 0.0
ORD	[MASK] she refused his advances and asked to leave, the reports say, he pulled her toward the bedroom, ordering her to remove her clothes.	41 42 61 62 120 121 122 123 124 125 126 127	0.0 0.0 0.0 1.0 0.0 0.0 0.0 0.0 0.0 0.0 0.0 0.0
ORD	"[MASK] you are all said and done, you own the same amount of pie,""Galvin said."	41 42 61 62 120 121 122 123 124 125 126 127	0.0 0.0 0.0 1.0 0.0 0.0 0.0 0.0 0.0 0.0 0.0 0.0
ORD	"He had chosen one of my stories [MASK] he edited Best American Short Stories""in 2007, Groff says,""so he knew my work."	41 42 61 62 120 121 122 123 124 125 126 127	0.0 0.0 0.0 1.0 0.0 0.0 0.0 0.0 0.0 0.0 0.0 0.0
ORD	"[MASK] an interview with the Financial Times published Friday, Verrone told the reporter that there was""room to negotiate""on the reality-TV proposal."	41 42 61 62 120 121 122 123 124 125 126 127	0.0 0.0 1.0 0.0 0.0 0.0 0.0 0.0 0.0 0.0 0.0 0.0
ORD	"""I'm going to heed my own advice [MASK] I tell guys that do n't make it."	41 42 61 62 120 121 122 123 124 125 126 127	0.0 0.0 0.0 1.0 0.0 0.0 0.0 0.0 0.0 0.0 0.0 0.0
ORD	A rest stop employee was quoted as saying he was getting out of his car in the parking lot [MASK] he saw a policeman and heard a shot, but could n't see what happened.	41 42 61 62 120 121 122 123 124 125 126 127	0.0 0.0 0.0 1.0 0.0 0.0 0.0 0.0 0.0 0.0 0.0 0.0
