ORD	But the permanent job could go to a Dons cult hero, [MASK] former frontman John Fashanu announced he was keen to take over.	41 42 61 62 120 121 122 123 124 125 126 127	1.0 0.0 0.0 0.0 0.0 0.0 0.0 0.0 0.0 0.0 0.0 0.0
ORD	So [MASK] Justice Sonia Sotomayor was having trouble with an Italian word Monday, she turned to Scalia, the U. S. Supreme Court's resident language maven.	41 42 61 62 120 121 122 123 124 125 126 127	0.0 0.0 0.0 1.0 0.0 0.0 0.0 0.0 0.0 0.0 0.0 0.0
ORD	[MASK] the heat and water bills became too expensive, he asked them to leave, he said.	41 42 61 62 120 121 122 123 124 125 126 127	0.0 0.0 0.0 1.0 0.0 0.0 0.0 0.0 0.0 0.0 0.0 0.0
ORD	MAFF Minister Yoshiyuki Kamei has urged the United States to test all slaughtered cattle for BSE as Japan does, or take measures that would have the same effect [MASK] Japan removes the ban.	41 42 61 62 120 121 122 123 124 125 126 127	0.0 1.0 0.0 0.0 0.0 0.0 0.0 0.0 0.0 0.0 0.0 0.0
ORD	Armed former fighters loyal to Johnson took positions outside their leader's home in Monrovia last Tuesday [MASK] he accused Taylor's elite bodyguard unit of attacking his house twice in two weeks.	41 42 61 62 120 121 122 123 124 125 126 127	1.0 0.0 0.0 0.0 0.0 0.0 0.0 0.0 0.0 0.0 0.0 0.0
ORD	Airlines in China carried 21.6 million passengers [MASK] the Spring Festival travel season, up 8 percent from last year, said the General Administration of Civil Aviation on Tuesday.	41 42 61 62 120 121 122 123 124 125 126 127	0.0 0.0 1.0 0.0 0.0 0.0 0.0 0.0 0.0 0.0 0.0 0.0
ORD	Harkin's office said that [MASK] these companies feel heat, they tend to close down and reopen under new names.	41 42 61 62 120 121 122 123 124 125 126 127	0.0 0.0 0.0 1.0 0.0 0.0 0.0 0.0 0.0 0.0 0.0 0.0
ORD	Their repatriation began [MASK] the disintegration of the former Soviet Union and the independence of Kazakhstan in 1991.	41 42 61 62 120 121 122 123 124 125 126 127	1.0 0.0 0.0 0.0 0.0 0.0 0.0 0.0 0.0 0.0 0.0 0.0
ORD	Regulators first saw a flood of complaints [MASK] the stock market imploded in 2001.	41 42 61 62 120 121 122 123 124 125 126 127	1.0 0.0 0.0 0.0 0.0 0.0 0.0 0.0 0.0 0.0 0.0 0.0
ORD	Bennett, a 32-year-old researcher for the Japanese Ministry of Education and a fifth-dan practitioner, first encountered kendo [MASK] he was a student at a Japanese high school in 1987.	41 42 61 62 120 121 122 123 124 125 126 127	0.0 0.0 0.0 1.0 0.0 0.0 0.0 0.0 0.0 0.0 0.0 0.0
ORD	The comments come [MASK] a week in which six Turks died in the Netherlands in a suspected arson attack, drawing calls from Ankara for extra measures to protect Turks living in the country.	41 42 61 62 120 121 122 123 124 125 126 127	1.0 0.0 0.0 0.0 0.0 0.0 0.0 0.0 0.0 0.0 0.0 0.0
ORD	Keirrison tapped in the opening score in the third minute [MASK] a well-placed pass from Cleiton Xaxier.	41 42 61 62 120 121 122 123 124 125 126 127	1.0 0.0 0.0 0.0 0.0 0.0 0.0 0.0 0.0 0.0 0.0 0.0
ORD	Against the Giants, [MASK] Owens made a spectacular 79-yard touchdown catch, Rice ran up to the muscular receiver, hugged him, and said, ` ` I remember doing that.''	41 42 61 62 120 121 122 123 124 125 126 127	1.0 0.0 0.0 0.0 0.0 0.0 0.0 0.0 0.0 0.0 0.0 0.0
ORD	But the explorers stopped in their tracks [MASK] they found the stone-carved images of two men embracing.	41 42 61 62 120 121 122 123 124 125 126 127	0.0 0.0 0.0 1.0 0.0 0.0 0.0 0.0 0.0 0.0 0.0 0.0
ORD	And [MASK] children are anxious about returning to school, she continued, it's especially important to ask them whether there are particular problems--a bully, a bathroom with no doors on the stalls.	41 42 61 62 120 121 122 123 124 125 126 127	0.0 0.0 0.0 1.0 0.0 0.0 0.0 0.0 0.0 0.0 0.0 0.0
ORD	Of course, sports is not enough [MASK] it comes to the array of emotional and behavioral problems the Walden Street School students are dealing with.	41 42 61 62 120 121 122 123 124 125 126 127	0.0 0.0 0.0 1.0 0.0 0.0 0.0 0.0 0.0 0.0 0.0 0.0
ORD	But if these countries have learned anything, it's that the weaker the banking system, the harder a country will fall [MASK] an economic crisis strikes.	41 42 61 62 120 121 122 123 124 125 126 127	0.0 0.0 0.0 1.0 0.0 0.0 0.0 0.0 0.0 0.0 0.0 0.0
ORD	Northern troops loyal to President Ali Abdallah Saleh marched into the eastern port of Mukalla, the headquarters of southern leader Ali Salem al-Baid, last week [MASK] seizing control of Aden on Thursday.	41 42 61 62 120 121 122 123 124 125 126 127	0.0 1.0 0.0 0.0 0.0 0.0 0.0 0.0 0.0 0.0 0.0 0.0
ORD	[MASK] they finally leave their offices, they are likely to face an hour in traffic jams.	41 42 61 62 120 121 122 123 124 125 126 127	0.0 0.0 0.0 1.0 0.0 0.0 0.0 0.0 0.0 0.0 0.0 0.0
ORD	Barton was fined six weeks'wages by his former club Manchester City in December 2004 [MASK] an incident in which he poked a cigar in the eye of youth-team player Jamie Tandy.	41 42 61 62 120 121 122 123 124 125 126 127	1.0 0.0 0.0 0.0 0.0 0.0 0.0 0.0 0.0 0.0 0.0 0.0
ORD	The report, compiled from information gathered by the central bank's 12 regional banks, will be used by the Fed [MASK] it meets Nov. 6 to discuss interest rates.	41 42 61 62 120 121 122 123 124 125 126 127	0.0 0.0 0.0 1.0 0.0 0.0 0.0 0.0 0.0 0.0 0.0 0.0
ORD	Colombia's Atletico Junior captured the title [MASK] scoring a 2-0 win over Germany's Borussia Monchengladbach in the Reebok Cup international soccer tournament in Chicago on Sunday.	41 42 61 62 120 121 122 123 124 125 126 127	1.0 0.0 0.0 0.0 0.0 0.0 0.0 0.0 0.0 0.0 0.0 0.0
ORD	She started dance [MASK] an injury kept her from jumping and never turned back.	41 42 61 62 120 121 122 123 124 125 126 127	0.0 0.0 0.0 1.0 0.0 0.0 0.0 0.0 0.0 0.0 0.0 0.0
ORD	Omara Portuondo, who later broke off from the quartet to perform solo [MASK] joining the world-famous Buena Vista Social Group of veteran musicians, sang briefly with the group on that recent night.	41 42 61 62 120 121 122 123 124 125 126 127	0.0 1.0 0.0 0.0 0.0 0.0 0.0 0.0 0.0 0.0 0.0 0.0
ORD	A local leader of the Hezbollah guerrillas fighting to drive Israel from southern Lebanon was killed Friday [MASK] his booby-trapped car exploded, security sources said.	41 42 61 62 120 121 122 123 124 125 126 127	0.0 0.0 0.0 1.0 0.0 0.0 0.0 0.0 0.0 0.0 0.0 0.0
ORD	Shares of Next fell 1.6 percent despite the fashion retailer raising its profit [MASK] sunny weather lifted sales.	41 42 61 62 120 121 122 123 124 125 126 127	1.0 0.0 0.0 0.0 0.0 0.0 0.0 0.0 0.0 0.0 0.0 0.0
ORD	Dutch striker Patrick Kluivert had deservedly given Newcastle the lead in the 79th minute [MASK] he backheeled Craig Bellamy's low cross past Eagles goalkeeper Gabor Kiraly.	41 42 61 62 120 121 122 123 124 125 126 127	0.0 0.0 0.0 1.0 0.0 0.0 0.0 0.0 0.0 0.0 0.0 0.0
ORD	"""[MASK] I got to the police car all my sisters and brothers were there."	41 42 61 62 120 121 122 123 124 125 126 127	0.0 0.0 0.0 1.0 0.0 0.0 0.0 0.0 0.0 0.0 0.0 0.0
ORD	Someone who got into this country illegally getting treatment for lung cancer contracted [MASK] trying to help injured Americans.	41 42 61 62 120 121 122 123 124 125 126 127	0.0 0.0 1.0 0.0 0.0 0.0 0.0 0.0 0.0 0.0 0.0 0.0
ORD	The farmers saw red [MASK] the MTUC initiated a nationwide boycott more than two months ago to protest against increased chicken prices.	41 42 61 62 120 121 122 123 124 125 126 127	0.0 0.0 0.0 1.0 0.0 0.0 0.0 0.0 0.0 0.0 0.0 0.0
ORD	` ` I got the injury [MASK] the tournament in Sydney, but it did n't bother me much until today's match,''Date said.	41 42 61 62 120 121 122 123 124 125 126 127	0.0 0.0 1.0 0.0 0.0 0.0 0.0 0.0 0.0 0.0 0.0 0.0
ORD	Seven rescue helicopters and about 40 ambulances took the injured to hospitals [MASK] the crash occurred around 9:40 a. m. (0740 GMT).	41 42 61 62 120 121 122 123 124 125 126 127	1.0 0.0 0.0 0.0 0.0 0.0 0.0 0.0 0.0 0.0 0.0 0.0
ORD	If Super Mario and The Great One have their way, Canadian hockey fans from British Columbia to Newfoundland will see gold rather than red [MASK] these Winter Olympics end Feb. 25.	41 42 61 62 120 121 122 123 124 125 126 127	0.0 0.0 0.0 1.0 0.0 0.0 0.0 0.0 0.0 0.0 0.0 0.0
ORD	It is a Friday in mid-November and this is their night, a night Jeremiah has dreamed of since grade school, [MASK] he first heard about the raw-nerved battles between Dorsey and Crenshaw High.	41 42 61 62 120 121 122 123 124 125 126 127	0.0 0.0 0.0 1.0 0.0 0.0 0.0 0.0 0.0 0.0 0.0 0.0
ORD	Ahmadinejad was expected to meet with the chiefs of Hamas and other Palestinian militant groups [MASK] his visit to Damascus, said Khaled Abdul-Majid of the Popular Struggle Front said.	41 42 61 62 120 121 122 123 124 125 126 127	0.0 0.0 1.0 0.0 0.0 0.0 0.0 0.0 0.0 0.0 0.0 0.0
ORD	"""[MASK] I looked at it, I could n't believe how clear the images were,""he told The Vancouver Sun in 1993."""	41 42 61 62 120 121 122 123 124 125 126 127	0.0 0.0 0.0 1.0 0.0 0.0 0.0 0.0 0.0 0.0 0.0 0.0
ORD	According to the Macao Statistics and Census Department, [MASK] the 1985-1989 period, over 44,590 flats with a total floor space of 3.7 million sq m were built.	41 42 61 62 120 121 122 123 124 125 126 127	0.0 0.0 1.0 0.0 0.0 0.0 0.0 0.0 0.0 0.0 0.0 0.0
ORD	` ` [MASK] I was discharged (from the Marines), my first thought was to join the LAPD.	41 42 61 62 120 121 122 123 124 125 126 127	0.0 0.0 0.0 1.0 0.0 0.0 0.0 0.0 0.0 0.0 0.0 0.0
ORD	In most cases, investors have as long as three years to collect the overdue taxes [MASK] they can foreclose on the properties.	41 42 61 62 120 121 122 123 124 125 126 127	0.0 1.0 0.0 0.0 0.0 0.0 0.0 0.0 0.0 0.0 0.0 0.0
ORD	The state's governor-elect, movie star Arnold Schwarzenegger, toured a stricken area in Ventura County and praised firefighters [MASK] being briefed by top officials.	41 42 61 62 120 121 122 123 124 125 126 127	1.0 0.0 0.0 0.0 0.0 0.0 0.0 0.0 0.0 0.0 0.0 0.0
ORD	` ` Sometimes [MASK] things are going well, you tend to forget that you need to slow down.	41 42 61 62 120 121 122 123 124 125 126 127	0.0 0.0 0.0 1.0 0.0 0.0 0.0 0.0 0.0 0.0 0.0 0.0
ORD	11 rally and fell less sharply [MASK] the market declined over the last few months.	41 42 61 62 120 121 122 123 124 125 126 127	0.0 0.0 0.0 1.0 0.0 0.0 0.0 0.0 0.0 0.0 0.0 0.0
ORD	The portfolio took some big hits [MASK] the stock market collapsed in 2001, but it has more than recovered with the recent spike in the Dow.	41 42 61 62 120 121 122 123 124 125 126 127	0.0 0.0 0.0 1.0 0.0 0.0 0.0 0.0 0.0 0.0 0.0 0.0
ORD	Betancourt, who has dual French-Colombian nationality, was given a clean bill of health [MASK] medical tests at a Paris military hospital Saturday.	41 42 61 62 120 121 122 123 124 125 126 127	1.0 0.0 0.0 0.0 0.0 0.0 0.0 0.0 0.0 0.0 0.0 0.0
ORD	Opener Matthew Hayden reignited the'walk'debate [MASK] he stood his ground as Australia laid the foundations for a hefty first innings in the second cricket Test against New Zealand at the Adelaide Oval on Friday.	41 42 61 62 120 121 122 123 124 125 126 127	0.0 0.0 0.0 1.0 0.0 0.0 0.0 0.0 0.0 0.0 0.0 0.0
ORD	[MASK] it first came out that Terry Glenn was going to be suspended for violating the NFL's substance abuse policy, his agent, James Gould, said the punishment was unwarranted because Glenn did n't test positive.	41 42 61 62 120 121 122 123 124 125 126 127	0.0 0.0 0.0 1.0 0.0 0.0 0.0 0.0 0.0 0.0 0.0 0.0
ORD	The fourth GPU member was arrested [MASK] an opposition protest in Libreville on March 20.	41 42 61 62 120 121 122 123 124 125 126 127	0.0 0.0 1.0 0.0 0.0 0.0 0.0 0.0 0.0 0.0 0.0 0.0
ORD	[MASK] the mid-December U. S.-British bombardment, Iraq declared it will not recognize the no-fly zones imposed by the U. S.-led Western allies and will fire on U. S. and British warplanes policing these zones.	41 42 61 62 120 121 122 123 124 125 126 127	1.0 0.0 0.0 0.0 0.0 0.0 0.0 0.0 0.0 0.0 0.0 0.0
ORD	Yeltsin, 62, drews cheers and hellos in Russian [MASK] she stepped out of a long black limousine.	41 42 61 62 120 121 122 123 124 125 126 127	0.0 0.0 0.0 1.0 0.0 0.0 0.0 0.0 0.0 0.0 0.0 0.0
ORD	[MASK] Ms. Barnes announced her departure last month, she left open the possibility of returning to the corporate world. (	41 42 61 62 120 121 122 123 124 125 126 127	0.0 0.0 0.0 1.0 0.0 0.0 0.0 0.0 0.0 0.0 0.0 0.0
ORD	He may also have other choices, such as dissolving parliament [MASK] the debate for fresh general elections, or just resigning to pay the way for a new prime minister from the current coalition.	41 42 61 62 120 121 122 123 124 125 126 127	0.0 1.0 0.0 0.0 0.0 0.0 0.0 0.0 0.0 0.0 0.0 0.0
ORD	Simeza said Chiluba had filed an urgent application asking the court to halt moves to prosecute him, arguing that parliament had flouted procedure [MASK] it lifted his immunity on Tuesday.	41 42 61 62 120 121 122 123 124 125 126 127	0.0 0.0 0.0 1.0 0.0 0.0 0.0 0.0 0.0 0.0 0.0 0.0
ORD	JAPAN-DOLLAR (Tokyo)--The dollar slipped against the yen [MASK] Japan's Kyodo news service reported the director general of the Finance Ministry's international finance bureau may resign, traders said.	41 42 61 62 120 121 122 123 124 125 126 127	1.0 0.0 0.0 0.0 0.0 0.0 0.0 0.0 0.0 0.0 0.0 0.0
ORD	Lucinda Naugle, 61, was awarded $ 56 million in compensatory damages and $ 244 million in punitive damages Thursday [MASK] a three-week trial and three hours of jury deliberation in Broward County Circuit Court.	41 42 61 62 120 121 122 123 124 125 126 127	1.0 0.0 0.0 0.0 0.0 0.0 0.0 0.0 0.0 0.0 0.0 0.0
ORD	Using his typical cautious approach, he had his public relations representative Mike Davis look over the article [MASK] submitting it for publication.	41 42 61 62 120 121 122 123 124 125 126 127	0.0 1.0 0.0 0.0 0.0 0.0 0.0 0.0 0.0 0.0 0.0 0.0
ORD	In the recent past, they have attacked deficit spending [MASK] promising to preserve tax cuts and defense budgets.	41 42 61 62 120 121 122 123 124 125 126 127	0.0 0.0 1.0 0.0 0.0 0.0 0.0 0.0 0.0 0.0 0.0 0.0
ORD	` ` I think it's frustrating I can make pitches, but then [MASK] it comes time to bury a guy I try to do more than I have to,''Ashby said.	41 42 61 62 120 121 122 123 124 125 126 127	0.0 0.0 0.0 1.0 0.0 0.0 0.0 0.0 0.0 0.0 0.0 0.0
ORD	The talks gained urgency last week [MASK] Pakistan's Supreme Court ruled that Nawaz Sharif, the prime minister Musharraf ousted in a 1999 coup, could return to Pakistan.	41 42 61 62 120 121 122 123 124 125 126 127	1.0 0.0 0.0 0.0 0.0 0.0 0.0 0.0 0.0 0.0 0.0 0.0
ORD	` ` I turned down $ 10,000 fights [MASK] we did n't have $ 60 in our pockets.	41 42 61 62 120 121 122 123 124 125 126 127	0.0 0.0 0.0 1.0 0.0 0.0 0.0 0.0 0.0 0.0 0.0 0.0
ORD	[MASK] scandal of any kind occurs, the church sweeps it under its vast ecclesiastical rug, makes the appropriate apologetic noises and calls the faithful to be blindly faithful.	41 42 61 62 120 121 122 123 124 125 126 127	0.0 0.0 0.0 1.0 0.0 0.0 0.0 0.0 0.0 0.0 0.0 0.0
ORD	Boston held a 15-point lead (82-67) with 4:17 left in the third [MASK] it began to unravel.	41 42 61 62 120 121 122 123 124 125 126 127	0.0 1.0 0.0 0.0 0.0 0.0 0.0 0.0 0.0 0.0 0.0 0.0
ORD	Operation Silver Wake was suspended [MASK] US Marine helicopters had flown 408 Americans from the strife-torn Albanian capital to US navy ships at sea, Colonel Richard Bridges added.	41 42 61 62 120 121 122 123 124 125 126 127	1.0 0.0 0.0 0.0 0.0 0.0 0.0 0.0 0.0 0.0 0.0 0.0
ORD	So positive was the team karma that it did not even seem to amaze [MASK] Saberhagen pitched six perfect innings in the middle game of that series, another Tuesday.	41 42 61 62 120 121 122 123 124 125 126 127	0.0 0.0 0.0 1.0 0.0 0.0 0.0 0.0 0.0 0.0 0.0 0.0
ORD	No reason was given, but the judge noted [MASK] the start of deliberations that he understood some jurors had obligations to attend graduation ceremonies for family members.	41 42 61 62 120 121 122 123 124 125 126 127	0.0 1.0 0.0 0.0 0.0 0.0 0.0 0.0 0.0 0.0 0.0 0.0
ORD	PLO chairman Yasser Arafat bade farewell to Tunisia on Monday as he left the country heading back for good to the Gaza Strip to start a new life [MASK] 27 years in exile.	41 42 61 62 120 121 122 123 124 125 126 127	1.0 0.0 0.0 0.0 0.0 0.0 0.0 0.0 0.0 0.0 0.0 0.0
ORD	"[MASK] you finally sit across from Leach at his desk, you're staring at a skull-and-crossbones banner reading,""The Beatings Will Continue Until Morale Improves."""	41 42 61 62 120 121 122 123 124 125 126 127	0.0 0.0 0.0 1.0 0.0 0.0 0.0 0.0 0.0 0.0 0.0 0.0
ORD	"The poorly named""reconciliation""process can be invoked [MASK] the Senate parliamentarian rules that a piece of pending legislation would have a budget impact."	41 42 61 62 120 121 122 123 124 125 126 127	0.0 0.0 0.0 1.0 0.0 0.0 0.0 0.0 0.0 0.0 0.0 0.0
ORD	On Saturday, [MASK] Shaw and his wife greeted voters, Klein enlisted former President Bill Clinton to help drill home his anti-incumbency theme at a rally in Pompano Beach.	41 42 61 62 120 121 122 123 124 125 126 127	0.0 0.0 1.0 0.0 0.0 0.0 0.0 0.0 0.0 0.0 0.0 0.0
ORD	Chavez said [MASK] his weekly radio program on Sunday that Russian President Dimitri Medvedev wanted to send a Russian naval fleet to visit Venezuela.	41 42 61 62 120 121 122 123 124 125 126 127	0.0 0.0 1.0 0.0 0.0 0.0 0.0 0.0 0.0 0.0 0.0 0.0
ORD	There were safety issues with the new facility, the pilot plant was minimally utilized, and [MASK] production began a year behind schedule, the Fogbank produced was unusable.	41 42 61 62 120 121 122 123 124 125 126 127	0.0 0.0 0.0 1.0 0.0 0.0 0.0 0.0 0.0 0.0 0.0 0.0
ORD	Storai, who last year became the first and only woman in India to win a Derby, arrived in India in 1979 as a tourist [MASK] she was 18 years old.	41 42 61 62 120 121 122 123 124 125 126 127	0.0 0.0 0.0 1.0 0.0 0.0 0.0 0.0 0.0 0.0 0.0 0.0
ORD	"There's also a flash of political consciousness on""American Blood""--the result, perhaps, of hanging out with troubadour-agitator Steve Earle a few years ago [MASK] collaborating on songs for various tribute albums."	41 42 61 62 120 121 122 123 124 125 126 127	0.0 0.0 1.0 0.0 0.0 0.0 0.0 0.0 0.0 0.0 0.0 0.0
ORD	He took off several weeks [MASK] losing in the fourth round at Key Biscayne at the end of March.	41 42 61 62 120 121 122 123 124 125 126 127	1.0 0.0 0.0 0.0 0.0 0.0 0.0 0.0 0.0 0.0 0.0 0.0
ORD	As recently as late Tuesday it appeared the lawyer, who successfully defended President Clinton [MASK] his Senate impeachment trial last year, would not be able to pull off the reunion.	41 42 61 62 120 121 122 123 124 125 126 127	0.0 0.0 1.0 0.0 0.0 0.0 0.0 0.0 0.0 0.0 0.0 0.0
ORD	_ President Jacques Chirac ` ` I plainly assume responsibility for this failure... And I draw the conclusions in withdrawing from political life [MASK] the end of the presidential election.''	41 42 61 62 120 121 122 123 124 125 126 127	1.0 0.0 0.0 0.0 0.0 0.0 0.0 0.0 0.0 0.0 0.0 0.0
ORD	[MASK] it's time to prune, the 66-year-old tree farmer disdains a ladder and shinnies up the trunk.	41 42 61 62 120 121 122 123 124 125 126 127	0.0 0.0 0.0 1.0 0.0 0.0 0.0 0.0 0.0 0.0 0.0 0.0
ORD	[MASK] I put a different size in, and click to continue, it automatically goes back to 12.	41 42 61 62 120 121 122 123 124 125 126 127	0.0 0.0 0.0 1.0 0.0 0.0 0.0 0.0 0.0 0.0 0.0 0.0
ORD	Up to 25 passengers were missing and feared drowned [MASK] their bus plunged into a fast-flowing canal in western India late Saturday, police said.	41 42 61 62 120 121 122 123 124 125 126 127	1.0 0.0 0.0 0.0 0.0 0.0 0.0 0.0 0.0 0.0 0.0 0.0
ORD	Ralph Middlebrooks Jr., of Dayton, Ohio, gave an irritated look [MASK] the subject of the phone company was raised.	41 42 61 62 120 121 122 123 124 125 126 127	0.0 0.0 0.0 1.0 0.0 0.0 0.0 0.0 0.0 0.0 0.0 0.0
ORD	"Jerusalem is a final status issue, which is why we continue to encourage both sides to get into direct negotiations,""said State Department Spokesman Philip Crowley [MASK] his daily media briefing."	41 42 61 62 120 121 122 123 124 125 126 127	0.0 0.0 1.0 0.0 0.0 0.0 0.0 0.0 0.0 0.0 0.0 0.0
ORD	He made the remarks [MASK] an unannounced visit to the White House briefing room, where Press Secretary Robert Gibbs was supposed to be holding a regular briefing.	41 42 61 62 120 121 122 123 124 125 126 127	0.0 0.0 1.0 0.0 0.0 0.0 0.0 0.0 0.0 0.0 0.0 0.0
ORD	The current Senate majority leader, Bob Dole, warned [MASK] his party's sweep in November 1994 that voters would have little tolerance for dallying or excuses.	41 42 61 62 120 121 122 123 124 125 126 127	1.0 0.0 0.0 0.0 0.0 0.0 0.0 0.0 0.0 0.0 0.0 0.0
ORD	[MASK] striking out Manny Ramirez and retiring Mike Lowell on a fly, Carmona delivered a 3-1 fastball over the middle of the plate to Drew, who belted it into the centerfield bleachers.	41 42 61 62 120 121 122 123 124 125 126 127	1.0 0.0 0.0 0.0 0.0 0.0 0.0 0.0 0.0 0.0 0.0 0.0
ORD	Romania has endured a lengthy transition to democracy and a market economy [MASK] throwing off its communist dictatorship in December 1989.	41 42 61 62 120 121 122 123 124 125 126 127	1.0 0.0 0.0 0.0 0.0 0.0 0.0 0.0 0.0 0.0 0.0 0.0
ORD	She reminded the public not to forget those victims in southern Malaysia [MASK] the country is now bracing for another round of floods in northern states.	41 42 61 62 120 121 122 123 124 125 126 127	0.0 0.0 1.0 0.0 0.0 0.0 0.0 0.0 0.0 0.0 0.0 0.0
ORD	At least 13 people died and 10 were injured [MASK] a passenger bus plunged into a river in Nepal Thursday, police said.	41 42 61 62 120 121 122 123 124 125 126 127	0.0 0.0 0.0 1.0 0.0 0.0 0.0 0.0 0.0 0.0 0.0 0.0
ORD	The deal made [MASK] the just-concluded trade ministers'meeting of the World Trade Organization (WTO) in Hong Kong will not affect Taiwan's agricultural sector, Council of Agriculture (COA) Vice Chairman Lee Chien-chuan said Sunday.	41 42 61 62 120 121 122 123 124 125 126 127	0.0 0.0 1.0 0.0 0.0 0.0 0.0 0.0 0.0 0.0 0.0 0.0
ORD	The victims perished [MASK] their wooden house in a small village near the town of Caykara collapsed in the landslip, Housing and Civil Works Minister Faruk Nafiz Ozak told reporters in the stricken province, the Anatolia news agency reported.	41 42 61 62 120 121 122 123 124 125 126 127	0.0 0.0 0.0 1.0 0.0 0.0 0.0 0.0 0.0 0.0 0.0 0.0
ORD	"It was the event of a lifetime,""said Stewart, who returned to the stage several years ago [MASK] a TV and movie career that included the role of Capt."	41 42 61 62 120 121 122 123 124 125 126 127	1.0 0.0 0.0 0.0 0.0 0.0 0.0 0.0 0.0 0.0 0.0 0.0
ORD	[MASK] he ever saw a live performance, Morgan got his first taste of dance through television.	41 42 61 62 120 121 122 123 124 125 126 127	0.0 1.0 0.0 0.0 0.0 0.0 0.0 0.0 0.0 0.0 0.0 0.0
ORD	The abundant words of praise were relayed to reporters by Deputy White House Press Secretary David Johnson [MASK] a 20-minute hastily scheduled meeting between the two presidents.	41 42 61 62 120 121 122 123 124 125 126 127	1.0 0.0 0.0 0.0 0.0 0.0 0.0 0.0 0.0 0.0 0.0 0.0
ORD	British Lion Simon Taylor plays for his own country at number eight [MASK] previously being selected for the Barbarians squad.	41 42 61 62 120 121 122 123 124 125 126 127	1.0 0.0 0.0 0.0 0.0 0.0 0.0 0.0 0.0 0.0 0.0 0.0
ORD	"""They must firstly recognise that the accident is grave and they must draw very clear consequences,""he said in Brussels [MASK] talks with EU Energy Commissioner Andris Pielbalgs."	41 42 61 62 120 121 122 123 124 125 126 127	1.0 0.0 0.0 0.0 0.0 0.0 0.0 0.0 0.0 0.0 0.0 0.0
ORD	Fronting a band that included five saxophones, four trumpets, four trombones, bass and drums, Setzer was most effective [MASK] blending his superb guitar work with his orchestra's swing sound.	41 42 61 62 120 121 122 123 124 125 126 127	0.0 0.0 0.0 1.0 0.0 0.0 0.0 0.0 0.0 0.0 0.0 0.0
ORD	The new bank would have been based in Boston and run by Stepanian for several years [MASK] CoreStates Chief Executive Terrence A. Larsen took over.	41 42 61 62 120 121 122 123 124 125 126 127	0.0 1.0 0.0 0.0 0.0 0.0 0.0 0.0 0.0 0.0 0.0 0.0
ORD	"The governor, speaking in the central Japanese city of Nagoya, said earlier that the yen was in a""correction phase""[MASK] soaring earlier this year."	41 42 61 62 120 121 122 123 124 125 126 127	1.0 0.0 0.0 0.0 0.0 0.0 0.0 0.0 0.0 0.0 0.0 0.0
ORD	About 160 businesses were destroyed or damaged by burning and looting [MASK] the riots, which were set off by a political rally calling for reform of the semi-feudal political system.	41 42 61 62 120 121 122 123 124 125 126 127	0.0 0.0 1.0 0.0 0.0 0.0 0.0 0.0 0.0 0.0 0.0 0.0
ORD	The 53-year-old man was shot to death [MASK] gassing up his car in Manassas, Virginia, about 28 miles (44 kilometers) west-southwest of the city.	41 42 61 62 120 121 122 123 124 125 126 127	1.0 0.0 0.0 0.0 0.0 0.0 0.0 0.0 0.0 0.0 0.0 0.0
ORD	[MASK] his 90-minute-long performance, Chan rendered tunes from his fifth Cantonese album, Hard Encounter.	41 42 61 62 120 121 122 123 124 125 126 127	0.0 0.0 1.0 0.0 0.0 0.0 0.0 0.0 0.0 0.0 0.0 0.0
ORD	He was released under an amnesty [MASK] serving 21 months of his sentence.	41 42 61 62 120 121 122 123 124 125 126 127	1.0 0.0 0.0 0.0 0.0 0.0 0.0 0.0 0.0 0.0 0.0 0.0
ORD	[MASK] the past 24 hours, Guangdong reported one new suspect SARS case.	41 42 61 62 120 121 122 123 124 125 126 127	0.0 0.0 1.0 0.0 0.0 0.0 0.0 0.0 0.0 0.0 0.0 0.0
ORD	ASM Lithography fell 5.7 percent [MASK] acknowledging problems in its merger with Silicon Valley Group.	41 42 61 62 120 121 122 123 124 125 126 127	1.0 0.0 0.0 0.0 0.0 0.0 0.0 0.0 0.0 0.0 0.0 0.0
ORD	Watch Duncan's stricken paralysis [MASK] she hears a knock at the door.)	41 42 61 62 120 121 122 123 124 125 126 127	0.0 0.0 0.0 1.0 0.0 0.0 0.0 0.0 0.0 0.0 0.0 0.0
ORD	There were large swaths of sweat stains by halftime and Crean's frustration boiled over in the second half [MASK] Pat Driscoll whistled him for a technical foul midway through the half.	41 42 61 62 120 121 122 123 124 125 126 127	0.0 0.0 0.0 1.0 0.0 0.0 0.0 0.0 0.0 0.0 0.0 0.0
ORD	[MASK] the California Supreme Court, citing requests from both sides in the dispute, decided not to hear the case, a private settlement was reached for an amount Christian later said was less than $ 6 million.	41 42 61 62 120 121 122 123 124 125 126 127	1.0 0.0 0.0 0.0 0.0 0.0 0.0 0.0 0.0 0.0 0.0 0.0
