ORD	The debt was incurred in 1651 [MASK] King Charles II--at the time recognized only as the king of Scotland--was preparing for the Battle of Worcester.	41 42 61 62 120 121 122 123 124 125 126 127	0.0 0.0 0.0 1.0 0.0 0.0 0.0 0.0 0.0 0.0 0.0 0.0
ORD	President Clinton spoke with Arafat by telephone about the attack and the Hebron accord, and urged the Palestinian leader to ` ` bear down and get done with it''[MASK] the situation grows worse.	41 42 61 62 120 121 122 123 124 125 126 127	0.0 1.0 0.0 0.0 0.0 0.0 0.0 0.0 0.0 0.0 0.0 0.0
ORD	Williams was trailing Clijsters 4-6, 5-6 and serving at 15-30 [MASK] the baseline judge called a foot-fault on a second serve.	41 42 61 62 120 121 122 123 124 125 126 127	0.0 0.0 0.0 1.0 0.0 0.0 0.0 0.0 0.0 0.0 0.0 0.0
ORD	European nations were among many that criticized Cuba [MASK] 75 dissidents were rounded up and sentenced to long prison terms in a massive crackdown two years ago.	41 42 61 62 120 121 122 123 124 125 126 127	1.0 0.0 0.0 0.0 0.0 0.0 0.0 0.0 0.0 0.0 0.0 0.0
ORD	The script is a hackneyed blend of romance, humor and swashbuckling, but the movie soars [MASK] Yeoh's limb-twisting action sequences and panoramic views of Tibet's Namtso Lake.	41 42 61 62 120 121 122 123 124 125 126 127	0.0 0.0 1.0 0.0 0.0 0.0 0.0 0.0 0.0 0.0 0.0 0.0
ORD	The West Indies were 236 for eight at tea on the opening day of the first cricket Test [MASK] winning the toss against Australia here on Thursday.	41 42 61 62 120 121 122 123 124 125 126 127	1.0 0.0 0.0 0.0 0.0 0.0 0.0 0.0 0.0 0.0 0.0 0.0
ORD	So, perhaps it was not surprising that the way the Jets described Davis, he was a running back without weaknesses, an athlete who compensates for his mistakes [MASK] taking advantage of the defense's errors.	41 42 61 62 120 121 122 123 124 125 126 127	0.0 0.0 1.0 0.0 0.0 0.0 0.0 0.0 0.0 0.0 0.0 0.0
ORD	French medical sources said Arafat's health had suddenly and dramatically deteriorated Wednesday [MASK] he was undergoing tests to determine the cause of an illness which prompted his medical evacuation to Paris last Friday.	41 42 61 62 120 121 122 123 124 125 126 127	0.0 0.0 1.0 0.0 0.0 0.0 0.0 0.0 0.0 0.0 0.0 0.0
ORD	A carjacker was killed Wednesday afternoon [MASK] he crashed a stolen pickup, carrying three young children and their teen-ager aunt, into a railing on the Ship Channel Bridge.	41 42 61 62 120 121 122 123 124 125 126 127	0.0 0.0 0.0 1.0 0.0 0.0 0.0 0.0 0.0 0.0 0.0 0.0
ORD	Schwarzenegger told reporters he would attend [MASK] a news conference in which the two dignitaries briefly discussed their shared commitment to reducing greenhouse gas emissions and energy consumption.	41 42 61 62 120 121 122 123 124 125 126 127	0.0 0.0 1.0 0.0 0.0 0.0 0.0 0.0 0.0 0.0 0.0 0.0
ORD	GERMAN ROUNDUP: Bremen travels to Munich FRANKFURT, Germany--Defending Bundesliga champion Bayern Munich seeks to pull into a three-way tie in second place [MASK] it plays Werder Bremen.	41 42 61 62 120 121 122 123 124 125 126 127	0.0 0.0 0.0 1.0 0.0 0.0 0.0 0.0 0.0 0.0 0.0 0.0
ORD	"He said his captors had told him that""very promising negotiations were ruined""[MASK] Hamas violently seized control of Gaza earlier this month and threatened to""press for a military solution to this kidnapping."""	41 42 61 62 120 121 122 123 124 125 126 127	0.0 0.0 0.0 1.0 0.0 0.0 0.0 0.0 0.0 0.0 0.0 0.0
ORD	The body of the unidentified 60-year-old man turned up in a Santa Barbara street [MASK] he apparently fell into the creek and was washed away, said Lt.	41 42 61 62 120 121 122 123 124 125 126 127	1.0 0.0 0.0 0.0 0.0 0.0 0.0 0.0 0.0 0.0 0.0 0.0
ORD	Tom Gordon pitched the ninth and allowed a run on Tim Salmon's RBI groundout [MASK] getting his 31st save.	41 42 61 62 120 121 122 123 124 125 126 127	0.0 1.0 0.0 0.0 0.0 0.0 0.0 0.0 0.0 0.0 0.0 0.0
ORD	It has also arranged transport for those who could not afford it [MASK] they lost their property in the xenophobic attacks which has displaced over 35,000 foreigners in South Africa.	41 42 61 62 120 121 122 123 124 125 126 127	1.0 0.0 0.0 0.0 0.0 0.0 0.0 0.0 0.0 0.0 0.0 0.0
ORD	"Canada may deport a suspected accomplice to the""millennium bomber,""whose plan was to hit US targets in December, [MASK] a federal court ruled he presents a danger to national security."	41 42 61 62 120 121 122 123 124 125 126 127	1.0 0.0 0.0 0.0 0.0 0.0 0.0 0.0 0.0 0.0 0.0 0.0
ORD	I admitted to favoring sweet corn bread, and Northerners called me a redneck [MASK] Southerners called me a traitor.	41 42 61 62 120 121 122 123 124 125 126 127	0.0 0.0 1.0 0.0 0.0 0.0 0.0 0.0 0.0 0.0 0.0 0.0
ORD	"On Thursday, a small group of youths attacked a photographer and smashed a police car [MASK] an otherwise peaceful protest involving about 10,000 marchers, who chanted""no to Privatization."""	41 42 61 62 120 121 122 123 124 125 126 127	0.0 0.0 1.0 0.0 0.0 0.0 0.0 0.0 0.0 0.0 0.0 0.0
ORD	Those hinges suggest big hands, and the handles are molded in an ergonomic way [MASK] anyone else was doing that.	41 42 61 62 120 121 122 123 124 125 126 127	0.0 1.0 0.0 0.0 0.0 0.0 0.0 0.0 0.0 0.0 0.0 0.0
ORD	Palestinian stone-throwers rioted in three West Bank towns Saturday and Israeli troops shot dead an Arab teen-ager [MASK] he stabbed an Israeli soldier.	41 42 61 62 120 121 122 123 124 125 126 127	1.0 0.0 0.0 0.0 0.0 0.0 0.0 0.0 0.0 0.0 0.0 0.0
ORD	Microsoft, [MASK] complying with an earlier ` ` civil investigative demand''for information, sued to quash a second, wide-ranging subpoena that required compliance within 40 hours.	41 42 61 62 120 121 122 123 124 125 126 127	1.0 0.0 0.0 0.0 0.0 0.0 0.0 0.0 0.0 0.0 0.0 0.0
ORD	Shares of E-Commerce China Dangdang Inc. soared in their initial public offering Wednesday, [MASK] pricing above the high-end of the online retailer's expected range.	41 42 61 62 120 121 122 123 124 125 126 127	1.0 0.0 0.0 0.0 0.0 0.0 0.0 0.0 0.0 0.0 0.0 0.0
ORD	[MASK] the Celtics signed Wilkins two summers ago as a free agent, the front office tabbed it as a ` ` major coup.''	41 42 61 62 120 121 122 123 124 125 126 127	0.0 0.0 0.0 1.0 0.0 0.0 0.0 0.0 0.0 0.0 0.0 0.0
ORD	Said Jinnit was speaking [MASK] talks with President Faure Gnassingbe in the capital Lome late Monday.	41 42 61 62 120 121 122 123 124 125 126 127	1.0 0.0 0.0 0.0 0.0 0.0 0.0 0.0 0.0 0.0 0.0 0.0
ORD	Serbia and Montenegro remained together [MASK] four other Yugoslav republics broke away from the six-republic Yugoslav federation in the early 1990s.	41 42 61 62 120 121 122 123 124 125 126 127	0.0 0.0 0.0 1.0 0.0 0.0 0.0 0.0 0.0 0.0 0.0 0.0
ORD	"But [MASK] they discovered he had made the first video, in April,""they relocated me from Tucson to Virginia with guards all around me and until this moment, I've been monitored by armed agents."""	41 42 61 62 120 121 122 123 124 125 126 127	1.0 0.0 0.0 0.0 0.0 0.0 0.0 0.0 0.0 0.0 0.0 0.0
ORD	"""The president is in a good mood,""White House spokesman Tony Snow said [MASK] US television networks buzzed with predictions, based on partial tallies, that fed opposition Democrats'hopes of retaking the US Congress."	41 42 61 62 120 121 122 123 124 125 126 127	0.0 1.0 0.0 0.0 0.0 0.0 0.0 0.0 0.0 0.0 0.0 0.0
ORD	"""Cooperation is manifest""through Egypt's joint projects with Uganda, Sudan, Ethiopia, Zambia and Kenya, Abu Zeid told reporters [MASK] a meeting among the Nile countries, also including Rwanda, Tanzania, Burundi and the Democratic Republic of Congo."	41 42 61 62 120 121 122 123 124 125 126 127	0.0 1.0 0.0 0.0 0.0 0.0 0.0 0.0 0.0 0.0 0.0 0.0
ORD	In 1994 [MASK] the conflict over the peninsula occurred between the two countries, Cameroon asked the court to rule on the sovereignty.	41 42 61 62 120 121 122 123 124 125 126 127	0.0 0.0 0.0 1.0 0.0 0.0 0.0 0.0 0.0 0.0 0.0 0.0
ORD	Gates made the remarks [MASK] giving lawmakers an early glimpse on President Barack Obama's war plans for Afghanistan and Iraq on the Capitol Hill.	41 42 61 62 120 121 122 123 124 125 126 127	0.0 0.0 0.0 1.0 0.0 0.0 0.0 0.0 0.0 0.0 0.0 0.0
ORD	The permanent secretariat was first suggested by Saudi Crown Prince Abdullah bin Abdul Aziz [MASK] the seventh IEF meeting, held here in 2000.	41 42 61 62 120 121 122 123 124 125 126 127	0.0 0.0 1.0 0.0 0.0 0.0 0.0 0.0 0.0 0.0 0.0 0.0
ORD	` ` [MASK] we went to the winter meetings, we really got a bad feeling for how other people were looking at our club,''Bavasi said.	41 42 61 62 120 121 122 123 124 125 126 127	0.0 0.0 0.0 1.0 0.0 0.0 0.0 0.0 0.0 0.0 0.0 0.0
ORD	Jeff Bagwell followed with a walk to mark the end for Stechschulte, but Dave Veres induced a fly out to right from Daryle Ward [MASK] striking out Richard Hidalgo to end the inning.	41 42 61 62 120 121 122 123 124 125 126 127	0.0 1.0 0.0 0.0 0.0 0.0 0.0 0.0 0.0 0.0 0.0 0.0
ORD	Long-term planning for water The Stanislaus Natural History Project took the county's Board of Supervisors to court for approving the high-end resort development, [MASK] farm bureau complaints that it would deplete agriculture's groundwater supply.	41 42 61 62 120 121 122 123 124 125 126 127	1.0 0.0 0.0 0.0 0.0 0.0 0.0 0.0 0.0 0.0 0.0 0.0
ORD	Houston called time out with 20.4 seconds left, and, [MASK] Phoenix trapped at midcourt, the ball was swung whimsically to Elie wide open in the corner.	41 42 61 62 120 121 122 123 124 125 126 127	0.0 0.0 0.0 1.0 0.0 0.0 0.0 0.0 0.0 0.0 0.0 0.0
ORD	Trajkovski made the remarks [MASK] meeting with U. S. State Department envoy James Pardew, the Macedonian news agency reported.	41 42 61 62 120 121 122 123 124 125 126 127	0.0 0.0 1.0 0.0 0.0 0.0 0.0 0.0 0.0 0.0 0.0 0.0
ORD	[MASK] the third round of debate, the draft law failed to specify whether private schools should seek profit over the public interest, which ignited sharp divisions among lawmakers.	41 42 61 62 120 121 122 123 124 125 126 127	0.0 0.0 1.0 0.0 0.0 0.0 0.0 0.0 0.0 0.0 0.0 0.0
ORD	[MASK] receiving a visiting trade delegation from China's northern Hebei Province, Bello said Nigeria has rich gas deposits that the Chinese business sector could tap together with its Nigerian counterparts.	41 42 61 62 120 121 122 123 124 125 126 127	0.0 0.0 1.0 0.0 0.0 0.0 0.0 0.0 0.0 0.0 0.0 0.0
ORD	Chinese President Hu Jintao urged the country's doctors to improve ethics and professional skills [MASK] a recent visit to a veteran military surgeon who is dying of cancer.	41 42 61 62 120 121 122 123 124 125 126 127	1.0 0.0 0.0 0.0 0.0 0.0 0.0 0.0 0.0 0.0 0.0 0.0
ORD	LL Cool J's career as a rapper resumes in November [MASK] a new, as yet untitled album comes out.	41 42 61 62 120 121 122 123 124 125 126 127	0.0 0.0 0.0 1.0 0.0 0.0 0.0 0.0 0.0 0.0 0.0 0.0
ORD	She continued her career [MASK] Germany's defeat in World War II in theaters in Duesseldof, Hamburg and Berlin.	41 42 61 62 120 121 122 123 124 125 126 127	1.0 0.0 0.0 0.0 0.0 0.0 0.0 0.0 0.0 0.0 0.0 0.0
ORD	It was that law that let the Globe reveal the gap between rhetoric and reality [MASK] it came to the Patrick administration's attempt to install state Senator Marian Walsh in a highly paid sinecure.	41 42 61 62 120 121 122 123 124 125 126 127	0.0 0.0 0.0 1.0 0.0 0.0 0.0 0.0 0.0 0.0 0.0 0.0
ORD	The dismal jobs news increased speculation that the US Federal Reserve would lower interest rates again [MASK] slashing its key rate by a half-point, to 1.0 percent, on October 29.	41 42 61 62 120 121 122 123 124 125 126 127	1.0 0.0 0.0 0.0 0.0 0.0 0.0 0.0 0.0 0.0 0.0 0.0
ORD	"German Foreign Minister Joschka Fischer Wednesday welcomed an Israeli plan to evacuate settlers from the Gaza Strip, calling it a""step in the right direction,""[MASK] talks with Justice Minister Yosef Lapid."	41 42 61 62 120 121 122 123 124 125 126 127	1.0 0.0 0.0 0.0 0.0 0.0 0.0 0.0 0.0 0.0 0.0 0.0
ORD	[MASK] the original Half-Life was released, the company employed 20; it now employs 65, all working on Half-Life 2.	41 42 61 62 120 121 122 123 124 125 126 127	0.0 0.0 0.0 1.0 0.0 0.0 0.0 0.0 0.0 0.0 0.0 0.0
ORD	He won his House seat from the New Orleans area in 1999 in a special election [MASK] the surprise resignation of Rep. Bob Livingston.	41 42 61 62 120 121 122 123 124 125 126 127	1.0 0.0 0.0 0.0 0.0 0.0 0.0 0.0 0.0 0.0 0.0 0.0
ORD	The shortage has been chronic in New York since the Reagan aAdministration dismissed striking controllers in 1981 [MASK] members of the Professional Air Traffic Controllers Organization went on strike over working conditions and pay.	41 42 61 62 120 121 122 123 124 125 126 127	1.0 0.0 0.0 0.0 0.0 0.0 0.0 0.0 0.0 0.0 0.0 0.0
ORD	International Business Machines Corp.'s stock rebounded, rising as much as 1 3/8 to 117 1/2 [MASK] dropping 2 to 116 1/8 yesterday.	41 42 61 62 120 121 122 123 124 125 126 127	1.0 0.0 0.0 0.0 0.0 0.0 0.0 0.0 0.0 0.0 0.0 0.0
ORD	More than 700 people have been killed in riots ignited [MASK] Muslims set fire to a train carrying Hindus returning from a pilgrimage to the holy site in Ayodhya.	41 42 61 62 120 121 122 123 124 125 126 127	0.0 0.0 0.0 1.0 0.0 0.0 0.0 0.0 0.0 0.0 0.0 0.0
ORD	Catcher Eliezer Alfonzo of the San Francisco Giants organization, was suspended 50 games [MASK] testing positive for a performance-enhancing substance, Major League Baseball said Wednesday.	41 42 61 62 120 121 122 123 124 125 126 127	1.0 0.0 0.0 0.0 0.0 0.0 0.0 0.0 0.0 0.0 0.0 0.0
ORD	There's something transformative about this presidency [MASK] you see this sort of online forum.	41 42 61 62 120 121 122 123 124 125 126 127	0.0 0.0 0.0 1.0 0.0 0.0 0.0 0.0 0.0 0.0 0.0 0.0
ORD	Rescue crews were searching Monday for three missing people [MASK] a small truck plunged from a bridge into a river in western Mexico, killing at least four passengers, authorities said.	41 42 61 62 120 121 122 123 124 125 126 127	1.0 0.0 0.0 0.0 0.0 0.0 0.0 0.0 0.0 0.0 0.0 0.0
ORD	The seven trainees are receiving free instruction in cargo and passenger transportation and ground services in the Civil Aviation University of China (CAUC) [MASK] the ten-day program starting from Monday.	41 42 61 62 120 121 122 123 124 125 126 127	0.0 0.0 1.0 0.0 0.0 0.0 0.0 0.0 0.0 0.0 0.0 0.0
ORD	"Speaking to reporters [MASK] the weekly cabinet meeting today, Michaelides said that""we would like international interest in Cyprus to be concerted and as keen as possible to be effective."""	41 42 61 62 120 121 122 123 124 125 126 127	0.0 1.0 0.0 0.0 0.0 0.0 0.0 0.0 0.0 0.0 0.0 0.0
ORD	But with the United States received a blow Thursday [MASK] Morgan Hamm pulled out due to an ankle injury, further weakening a team already missing Hamm's injured brother Paul, the defending individual all-around champion.	41 42 61 62 120 121 122 123 124 125 126 127	0.0 0.0 0.0 1.0 0.0 0.0 0.0 0.0 0.0 0.0 0.0 0.0
ORD	Last year starting in April, Delta also had a five-month string of operating profits [MASK] summer vacation travelers filled its jets.	41 42 61 62 120 121 122 123 124 125 126 127	0.0 0.0 0.0 1.0 0.0 0.0 0.0 0.0 0.0 0.0 0.0 0.0
ORD	But the language of the bill was loose enough that it would let him use Medicare funds to pay for a new prescription drug benefit [MASK] he presents his budget to Congress.	41 42 61 62 120 121 122 123 124 125 126 127	0.0 0.0 0.0 1.0 0.0 0.0 0.0 0.0 0.0 0.0 0.0 0.0
ORD	[MASK] wins over 2007 Australian Open finalist Fernando Gonzalez of Chile and 2008 Australian champion Novak Djokovic to reach the final, Verdasco only needed 84 minutes to beat Tsonga, a surprise finalist at Melbourne Park two years ago.	41 42 61 62 120 121 122 123 124 125 126 127	1.0 0.0 0.0 0.0 0.0 0.0 0.0 0.0 0.0 0.0 0.0 0.0
ORD	"This all started [MASK], as in a""Seinfeld""rerun, Lillien drove 40 miles to have her favorite low-fat pastries tested at a lab."	41 42 61 62 120 121 122 123 124 125 126 127	0.0 0.0 0.0 1.0 0.0 0.0 0.0 0.0 0.0 0.0 0.0 0.0
ORD	` ` [MASK] I bought my first set of cows, the market was still pretty good,''he said.	41 42 61 62 120 121 122 123 124 125 126 127	0.0 0.0 0.0 1.0 0.0 0.0 0.0 0.0 0.0 0.0 0.0 0.0
ORD	Two weeks earlier, Hakim, 57, flew to the United States for medical tests [MASK] travelling on to Tehran.	41 42 61 62 120 121 122 123 124 125 126 127	0.0 1.0 0.0 0.0 0.0 0.0 0.0 0.0 0.0 0.0 0.0 0.0
ORD	[MASK] it closed eight years ago, the Miramar was an affordable beachfront destination for families from across Southern California.	41 42 61 62 120 121 122 123 124 125 126 127	0.0 1.0 0.0 0.0 0.0 0.0 0.0 0.0 0.0 0.0 0.0 0.0
ORD	In Paris industrial gas group Air Liquide added 3.86 percent to close at 147.90 [MASK] surprising investors by posting stronger-than-expected first-half profits and raising its profit target for the year.	41 42 61 62 120 121 122 123 124 125 126 127	1.0 0.0 0.0 0.0 0.0 0.0 0.0 0.0 0.0 0.0 0.0 0.0
ORD	Korea-defect BEIJING: South Korean negotiators held urgent talks here with North Korea's most senior defector, party secretary Hwang Jang-Yop, [MASK] a failed attempt by Pyongyang agents to recapture him.	41 42 61 62 120 121 122 123 124 125 126 127	1.0 0.0 0.0 0.0 0.0 0.0 0.0 0.0 0.0 0.0 0.0 0.0
ORD	In Baghdad, security forces sought to tighten strict security precautions further [MASK] a series of rebel attacks at the start of Ramadan last year, some of them on Christian churches.	41 42 61 62 120 121 122 123 124 125 126 127	1.0 0.0 0.0 0.0 0.0 0.0 0.0 0.0 0.0 0.0 0.0 0.0
ORD	A European export ban on British livestock, meat and dairy products which was imposed [MASK] the Surrey foot-and-mouth outbreak, was lifted Saturday, the BBC reported.	41 42 61 62 120 121 122 123 124 125 126 127	1.0 0.0 0.0 0.0 0.0 0.0 0.0 0.0 0.0 0.0 0.0 0.0
ORD	[MASK] an army of journalists and camera crews, Abdel Hay said he counted 220 people inside the church including the clerics.	41 42 61 62 120 121 122 123 124 125 126 127	0.0 1.0 0.0 0.0 0.0 0.0 0.0 0.0 0.0 0.0 0.0 0.0
ORD	[MASK] Chad Curtis popped out, Ivan Rodriguez lined a one-hop double off the right-field wall that was touched by a fan, moving Alicea to third.	41 42 61 62 120 121 122 123 124 125 126 127	1.0 0.0 0.0 0.0 0.0 0.0 0.0 0.0 0.0 0.0 0.0 0.0
ORD	` ` [MASK] the cheeses are fresh they have the flavor of a particular mountain flower, the Alpine star,''said Borgna.	41 42 61 62 120 121 122 123 124 125 126 127	0.0 0.0 0.0 1.0 0.0 0.0 0.0 0.0 0.0 0.0 0.0 0.0
ORD	` ` [MASK] he wrote ` Gulag'he did n't have a single archival document in his hands, but now they teach Russian history according to Solzhenitsyn,''said Alexander Nevzorov, a TV journalist turned ultranationalist politician.	41 42 61 62 120 121 122 123 124 125 126 127	0.0 0.0 0.0 1.0 0.0 0.0 0.0 0.0 0.0 0.0 0.0 0.0
ORD	No workplace has the notoriety of the U. S. Postal Service [MASK] it comes to on-the-job violence.	41 42 61 62 120 121 122 123 124 125 126 127	0.0 0.0 0.0 1.0 0.0 0.0 0.0 0.0 0.0 0.0 0.0 0.0
ORD	Home Depot, the largest U. S. home-improvement retailer, raised its dividend on Feb. 23 for the first time since 2006 [MASK] reporting a fourth-quarter profit that topped analysts'estimates.	41 42 61 62 120 121 122 123 124 125 126 127	1.0 0.0 0.0 0.0 0.0 0.0 0.0 0.0 0.0 0.0 0.0 0.0
ORD	They're seeking the death penalty for two men convicted of beating a 22-year-old man to death with rough stones and wooden planks [MASK] a spat on a local bus.	41 42 61 62 120 121 122 123 124 125 126 127	1.0 0.0 0.0 0.0 0.0 0.0 0.0 0.0 0.0 0.0 0.0 0.0
ORD	[MASK] I was in Japan, spring training started January 1.	41 42 61 62 120 121 122 123 124 125 126 127	0.0 0.0 0.0 1.0 0.0 0.0 0.0 0.0 0.0 0.0 0.0 0.0
ORD	Fetisov joined the Devils in 1989 [MASK] barriers to pro hockey fell in his homeland, and helped the Detroit Red Wings win the Stanley Cup in 1997 and in 1998.	41 42 61 62 120 121 122 123 124 125 126 127	1.0 0.0 0.0 0.0 0.0 0.0 0.0 0.0 0.0 0.0 0.0 0.0
ORD	His chance came [MASK] Ike Hilliard was sidelined for much of the Eagles game with general soreness, and Tim Carter was out with a mild concussion.	41 42 61 62 120 121 122 123 124 125 126 127	0.0 0.0 0.0 1.0 0.0 0.0 0.0 0.0 0.0 0.0 0.0 0.0
ORD	By the time he stopped a regular surgical schedule, [MASK] he was in his 80s, he had performed more than 60,000 operations.	41 42 61 62 120 121 122 123 124 125 126 127	0.0 0.0 0.0 1.0 0.0 0.0 0.0 0.0 0.0 0.0 0.0 0.0
ORD	Shares in the wireless services provider tumbled more than 12 percent to 131.25 pence (US$ 2.62) on the London Stock Exchange [MASK] the trading update was posted.	41 42 61 62 120 121 122 123 124 125 126 127	1.0 0.0 0.0 0.0 0.0 0.0 0.0 0.0 0.0 0.0 0.0 0.0
ORD	Cloaked in their cold-as-fish personae, they withheld love from their children and then complained bitterly [MASK] they perceived they were not loved in return.	41 42 61 62 120 121 122 123 124 125 126 127	0.0 0.0 0.0 1.0 0.0 0.0 0.0 0.0 0.0 0.0 0.0 0.0
ORD	` ` It's out of the question that we would have a monetary policy that does n't conform''with this objective,''Chirac said [MASK] a meeting of more than an hour.	41 42 61 62 120 121 122 123 124 125 126 127	1.0 0.0 0.0 0.0 0.0 0.0 0.0 0.0 0.0 0.0 0.0 0.0
ORD	[MASK] a 1-4 start, the Raiders won three in a row to go.500.	41 42 61 62 120 121 122 123 124 125 126 127	1.0 0.0 0.0 0.0 0.0 0.0 0.0 0.0 0.0 0.0 0.0 0.0
ORD	[MASK] the six-week commission meeting, allegations of violations in countries including Iraq, Sudan and Myanmar as well as the Yugoslav province of Kosovo also are likely to be examined.	41 42 61 62 120 121 122 123 124 125 126 127	0.0 0.0 1.0 0.0 0.0 0.0 0.0 0.0 0.0 0.0 0.0 0.0
ORD	"""Everybody is different but Scott Brown will be desperate to put a shirt on for Wednesday [MASK] being out for 10 weeks."""	41 42 61 62 120 121 122 123 124 125 126 127	1.0 0.0 0.0 0.0 0.0 0.0 0.0 0.0 0.0 0.0 0.0 0.0
ORD	The State Department reportedly offered immunity to employees of the private security firm [MASK] a probe into a Baghdad shooting that left 17 civilians dead.	41 42 61 62 120 121 122 123 124 125 126 127	0.0 0.0 1.0 0.0 0.0 0.0 0.0 0.0 0.0 0.0 0.0 0.0
ORD	Other studies have found that [MASK] very sick patients receive CPR, fewer than 10 percent survive to leave the hospital and many of those suffer a severe loss in quality of life.	41 42 61 62 120 121 122 123 124 125 126 127	0.0 0.0 0.0 1.0 0.0 0.0 0.0 0.0 0.0 0.0 0.0 0.0
ORD	At least six people were killed and 15 wounded Friday night [MASK] three bombs exploded in a single street, residents said. (	41 42 61 62 120 121 122 123 124 125 126 127	0.0 0.0 0.0 1.0 0.0 0.0 0.0 0.0 0.0 0.0 0.0 0.0
ORD	Person has found that he can sense [MASK] a client wants a cigarette, and he's frequently benefited from walking outside with them, taking a break and talking on a different level.	41 42 61 62 120 121 122 123 124 125 126 127	0.0 0.0 0.0 1.0 0.0 0.0 0.0 0.0 0.0 0.0 0.0 0.0
ORD	Conjecture about the race to succeed Socialist President Francois Mitterrand intensified at the weekend [MASK] the opposition Socialist Party dumped its most likely candidate, Michel Rocard.	41 42 61 62 120 121 122 123 124 125 126 127	1.0 0.0 0.0 0.0 0.0 0.0 0.0 0.0 0.0 0.0 0.0 0.0
ORD	Earlier in his career, had Hitler received a more severe jail sentence than he did [MASK] his beer hall putsch in 1923, his fortunes, and the world's, would almost surely have been different.	41 42 61 62 120 121 122 123 124 125 126 127	1.0 0.0 0.0 0.0 0.0 0.0 0.0 0.0 0.0 0.0 0.0 0.0
ORD	Long an advocate of universal health care, she said Obama's current proposal leaves millions uncovered and that Edwards did not support health care for all [MASK] he first ran for president in 2004.	41 42 61 62 120 121 122 123 124 125 126 127	0.0 0.0 0.0 1.0 0.0 0.0 0.0 0.0 0.0 0.0 0.0 0.0
ORD	It has been in turmoil [MASK] much of the four-year tenure of Bloch, who has repeatedly been accused of using it to promote conservative social causes.	41 42 61 62 120 121 122 123 124 125 126 127	0.0 0.0 1.0 0.0 0.0 0.0 0.0 0.0 0.0 0.0 0.0 0.0
ORD	"A misunderstood""genius,""according to Richardson, he had been committed to a mental facility [MASK] writing""Zen""; his son Chris, who accompanied Pirsig on the""Zen""journey, was later murdered."	41 42 61 62 120 121 122 123 124 125 126 127	0.0 1.0 0.0 0.0 0.0 0.0 0.0 0.0 0.0 0.0 0.0 0.0
ORD	The few survivors apparently escaped [MASK] a man smashed a rear window of the car with a ski pole, the Austria Press Agency quoted an unidentified hospital official as saying.	41 42 61 62 120 121 122 123 124 125 126 127	1.0 0.0 0.0 0.0 0.0 0.0 0.0 0.0 0.0 0.0 0.0 0.0
ORD	U. S. Vice President Dick Cheney arrived Saturday in Saudi Arabia for talks with King Abdullah, apparently seeking the Sunni royal family's influence and tribal connections to calm Iraq [MASK] an especially violent week.	41 42 61 62 120 121 122 123 124 125 126 127	1.0 0.0 0.0 0.0 0.0 0.0 0.0 0.0 0.0 0.0 0.0 0.0
ORD	Aussie Aaron Baddeley withdrew [MASK] opening with a 74.	41 42 61 62 120 121 122 123 124 125 126 127	1.0 0.0 0.0 0.0 0.0 0.0 0.0 0.0 0.0 0.0 0.0 0.0
ORD	The former Yugoslav president was likely to face his old nemesis across the courtroom on Friday [MASK] Rugova was scheduled to testify.	41 42 61 62 120 121 122 123 124 125 126 127	0.0 0.0 0.0 1.0 0.0 0.0 0.0 0.0 0.0 0.0 0.0 0.0
ORD	He quit performing at 83, [MASK] his asthma worsened and threw off his timing.	41 42 61 62 120 121 122 123 124 125 126 127	0.0 0.0 0.0 1.0 0.0 0.0 0.0 0.0 0.0 0.0 0.0 0.0
ORD	"""I told him that it should take place [MASK] the (Lebanese legislative) elections (due by the end of May) to avoid other problems, and I believe he is fully aware of this."	41 42 61 62 120 121 122 123 124 125 126 127	0.0 1.0 0.0 0.0 0.0 0.0 0.0 0.0 0.0 0.0 0.0 0.0
ORD	The sale of a majority of the assets closed on June 30, and the rest of the sold assets will be transferred [MASK] the third quarter of 2005.	41 42 61 62 120 121 122 123 124 125 126 127	0.0 0.0 1.0 0.0 0.0 0.0 0.0 0.0 0.0 0.0 0.0 0.0
ORD	He made the remarks [MASK] meeting with China Taxation Commissioner General Jin Renqing.	41 42 61 62 120 121 122 123 124 125 126 127	0.0 0.0 0.0 1.0 0.0 0.0 0.0 0.0 0.0 0.0 0.0 0.0
ORD	Three years ago, [MASK] Curtis began working at ASU, she had read about the power breakfast trend, but had never mixed oatmeal with business.	41 42 61 62 120 121 122 123 124 125 126 127	0.0 0.0 0.0 1.0 0.0 0.0 0.0 0.0 0.0 0.0 0.0 0.0
